{
  "mode": "guided",
  "full_name": "Jane Quinn Example",
  "first_name": "Jane",
  "middle_name": "Quinn",
  "last_name": "Example",
  "aliases": [
    "Jane Q Example",
    "Jane Sample"
  ],
  "date_of_birth": "1980-01-31",
  "state_of_residence": "CA",
  "current_address": {
    "line1": "100 Example Street",
    "line2": "Apt 4",
    "city": "Sacramento",
    "state": "CA",
    "postal_code": "95814"
  },
  "prior_addresses": [
    {
      "line1": "22 Sample Road",
      "line2": "",
      "city": "Reno",
      "state": "NV",
      "postal_code": "89501"
    }
  ],
  "phones": [
    "555-0100"
  ],
  "emails": [
    "jane.example@example.com"
  ],
  "relatives": [
    "John Example",
    "Mary Example"
  ],
  "opt_out_reason": "Privacy concerns",
  "contact_email": "alex+jane@example.com",
  "contact_phone": "555-0177",
  "authorized_agent": {
    "name": "Alex Example",
    "email": "alex+jane@example.com",
    "authorization_ref": "authorization-jane-quinn-example-2026-09-09.pdf"
  },
  "email_use": [
    {
      "email": "alex+jane@example.com",
      "broker": "nuwber",
      "used_on": "2026-09-14"
    }
  ],
  "known_records": [
    {
      "broker": "nuwber",
      "description": "Listed as Jane Sample at the Reno address, with John Example as a relative and a birth year that is wrong",
      "reviewed_on": "2026-09-14",
      "decision": "mine_left",
      "reason": "Mine, with a wrong birth year. Left because this broker takes one request per address and the spare addresses are worth more elsewhere."
    },
    {
      "broker": "spokeo",
      "description": "Jane Example in Sacramento with no relatives in common",
      "reviewed_on": "2026-09-14",
      "decision": "not_me",
      "reason": "None of the relatives listed are mine and the address history shares nothing with the profile."
    }
  ]
}
